{
  "allowed_delivery_presets": [
    "x_alpha25_v1",
    "x_alpha45_v1",
    "diagnostic_60s_v1"
  ],
  "authority_snapshot": {
    "decision_ids": [
      "AD-013",
      "AD-015",
      "AD-016",
      "AD-017",
      "AD-019",
      "AD-020",
      "AD-021",
      "AD-022",
      "AD-023",
      "AD-024",
      "AD-025",
      "AD-026",
      "AD-027",
      "AD-028",
      "AD-029",
      "AD-030"
    ],
    "interchange_manifest_version": "0.8.0",
    "interchange_phase": "WG-I8",
    "policy_artifact_ids": [
      "x_alpha_reference_calibration_v1",
      "x_alpha_carrier_frequency_policy_v1",
      "x_alpha_pulse_pattern_grammar_v1",
      "x_alpha_macro_density_state_model_v1",
      "x_alpha_timing_dependency_policy_v1"
    ]
  },
  "calibration_policy": {
    "authority_artifact_id": "x_alpha_reference_calibration_v1",
    "resolved_validation": {
      "default_limiter": false,
      "invalid_headroom_policy": "fail_validation",
      "per_motif_normalization": false,
      "per_session_normalization": false,
      "preserve_relative_amplitude_relationships": true,
      "reference_multiplier": 1.1
    }
  },
  "channel_topology": {
    "focus_role": {
      "associated_density_emphasis": true,
      "changes_global_playback_intensity": false,
      "changes_render_calibration": false,
      "fixed_physical_channel": false,
      "mapping_status": "unresolved_no_authoritative_default",
      "role_bundle": "focus_with_density_emphasis",
      "role_name": "focus_role",
      "target_logical_channel": null
    },
    "indexing": "zero_based_0_7",
    "logical_channel_count": 8,
    "logical_channel_ids": [
      0,
      1,
      2,
      3,
      4,
      5,
      6,
      7
    ],
    "upstream_translation": "none"
  },
  "content_hash": "41eeb636c411de429f316f0b84cbcd1ff0e4598400f4ee2d1e310582f44e0578",
  "created_at": "2026-06-21T00:00:00Z",
  "dependency_policy": "x_alpha_timing_dependency_policy_v1",
  "display_name": "X-Alpha Standard",
  "executable": false,
  "frozen_authority": {
    "archive_sha256": "7e248804420fdcc75713fd3c232f6c97f5581d01be83526f0ea5770002fc29dd",
    "asset_access": "prohibited_in_wge1",
    "identity_count": 84,
    "identity_index_reference": "bank/frozen_assets/frozen_motif_identity_index.json"
  },
  "immutable": true,
  "implementation_phase": "WGE-2-or-later",
  "lever_set_id": "x_alpha_standard_lever_set_v1",
  "macro_density_policy": "x_alpha_macro_density_state_model_v1",
  "notes": [
    "Locked root source profile. Numeric Tier 2 mode distributions remain reference-only."
  ],
  "parent_content_hash": null,
  "parent_profile_id": null,
  "parent_profile_version": null,
  "permitted_configuration_surface": {
    "calibration_override": false,
    "carrier_control": false,
    "focus_role_override": false,
    "motif_timing_override": false,
    "pulse_pattern_internal_override": false
  },
  "profile_id": "x_alpha_standard_v1",
  "profile_status": "preset_locked",
  "profile_version": "1.0.0",
  "pulse_pattern_policy": "x_alpha_pulse_pattern_grammar_v1",
  "schema_version": "wge.source_profile.v1",
  "selectable": true,
  "session_mode_assignments": "bank/mode_profiles/session_mode_profiles.json",
  "session_topology": {
    "selection": "run_request",
    "session_count": 7,
    "sessions": [
      {
        "mode_id": "baseline",
        "session_id": 1
      },
      {
        "mode_id": "baseline",
        "session_id": 2
      },
      {
        "mode_id": "baseline",
        "session_id": 3
      },
      {
        "mode_id": "baseline",
        "session_id": 4
      },
      {
        "mode_id": "dense",
        "session_id": 5
      },
      {
        "mode_id": "dense",
        "session_id": 6
      },
      {
        "mode_id": "complex",
        "session_id": 7
      }
    ]
  },
  "source_kind": "frozen_alpha_corpus",
  "timing_policy": "x_alpha_carrier_frequency_policy_v1",
  "trust_level": "exact"
}
